{
  "id": "video_373",
  "topicRef": "video_373",
  "topic": "How States Balance Freedom and Control",
  "title": "How States Balance Freedom and Control",
  "category": "POWER & INSTITUTIONS",
  "accentColor": "#a78bfa",
  "templateFamily": "systems_explainer",
  "templateHint": "protest",
  "defaultProfiles": [
    "shorts_vertical",
    "social_square",
    "youtube_horizontal"
  ],
  "metadataHints": {
    "summary": "How States Balance Freedom and Control explained as a systems video.",
    "keywords": [
      "how",
      "states",
      "balance",
      "freedom",
      "and",
      "control",
      "power",
      "institutions"
    ],
    "hashtags": [
      "#How",
      "#States",
      "#Balance",
      "#Freedom",
      "#And",
      "#Control"
    ],
    "hook": "How States Balance Freedom and Control looks simple on the surface, but it is really a system of incentives, rules, and feedback loops."
  },
  "audioMode": "text_only",
  "scenePlan": [
    {
      "sceneId": "scene_01",
      "label": "Topic frame",
      "purpose": "hook",
      "narrationText": "How States Balance Freedom and Control looks simple on the surface, but it is really a system of incentives, rules, and feedback loops.",
      "onScreenText": "How States Balance Freedom and Control",
      "subtext": "Deconstructing the invisible machinery.",
      "visualGrammar": "hook_tension",
      "visual": "crowd",
      "visualDirection": "Open on people and motion to make the topic feel immediate and human.",
      "assetRefs": [
        "CharacterHappy",
        "CharacterSad",
        "CharacterGeek"
      ],
      "cameraIntent": "slow_zoom_in",
      "motion": "pan",
      "backgroundMode": "gradient",
      "overlays": [
        "grain",
        "vignette"
      ],
      "palette": {
        "background": "#1e1b4b",
        "secondary": "#312e81"
      },
      "mood": "neutral",
      "timingHints": {
        "baseSeconds": 10
      },
      "profileOverrides": {}
    },
    {
      "sceneId": "scene_02",
      "label": "Hook",
      "purpose": "tension",
      "narrationText": "This matters because how states balance freedom and control changes what people can afford, access, or influence in everyday life.",
      "onScreenText": "Why It Matters",
      "subtext": "The critical vulnerabilities hidden within How States Balance Freedom and Control.",
      "visualGrammar": "icon_pressure",
      "visual": "icons",
      "visualDirection": "Use a dense icon field that quickly frames the pressure point or conflict.",
      "assetRefs": [
        "law",
        "shield",
        "scale",
        "PropDeclarativeRobot",
        "PropServer",
        "PropDeclarativeSaturn"
      ],
      "cameraIntent": "pan_right",
      "motion": "pan",
      "backgroundMode": "gradient",
      "overlays": [
        "grain",
        "vignette"
      ],
      "palette": {
        "background": "#1e1b4b",
        "secondary": "#312e81"
      },
      "mood": "stressed",
      "timingHints": {
        "baseSeconds": 10
      },
      "profileOverrides": {}
    },
    {
      "sceneId": "scene_03",
      "label": "System boundary",
      "purpose": "system_boundary",
      "narrationText": "To understand it, start by mapping the main actors, the rules they follow, and the limits of the system.",
      "onScreenText": "System Boundary",
      "subtext": "Where does the jurisdiction of this system begin and end?",
      "visualGrammar": "system_map",
      "visual": "network",
      "visualDirection": "Show the system as connected nodes so the audience sees where the edges are.",
      "assetRefs": [
        "law",
        "shield",
        "scale",
        "network",
        "arrow"
      ],
      "cameraIntent": "static_focus",
      "motion": "pan",
      "backgroundMode": "mesh",
      "overlays": [
        "grain",
        "vignette",
        "scanlines"
      ],
      "palette": {
        "background": "#1e1b4b",
        "secondary": "#312e81"
      },
      "mood": "thinking",
      "timingHints": {
        "baseSeconds": 10
      },
      "profileOverrides": {}
    },
    {
      "sceneId": "scene_04",
      "label": "Cause layer 1",
      "purpose": "root_cause",
      "narrationText": "The first layer is the core driver that keeps how states balance freedom and control moving even when the outcomes look unfair or inefficient.",
      "onScreenText": "Root Cause",
      "subtext": "The primary engine driving How States Balance Freedom and Control.",
      "visualGrammar": "causal_chain",
      "visual": "math_equation",
      "visualDirection": "Present the first causal layer as a simple abstract mechanism or formula.",
      "assetRefs": [
        "chart",
        "arrow",
        "gear",
        "law",
        "shield"
      ],
      "cameraIntent": "slow_zoom_in",
      "motion": "pan",
      "backgroundMode": "mesh",
      "overlays": [
        "grain",
        "vignette"
      ],
      "palette": {
        "background": "#1e1b4b",
        "secondary": "#312e81"
      },
      "mood": "neutral",
      "timingHints": {
        "baseSeconds": 10
      },
      "profileOverrides": {}
    },
    {
      "sceneId": "scene_05",
      "label": "Cause layer 2",
      "purpose": "mechanism",
      "narrationText": "Then that driver flows through institutions, prices, behavior, and public expectations.",
      "onScreenText": "Mechanism",
      "subtext": "How these mechanisms propagate through the network.",
      "visualGrammar": "process_flow",
      "visual": "flow",
      "visualDirection": "Turn the mechanism into directional movement so cause and effect read instantly.",
      "assetRefs": [
        "arrow",
        "loop",
        "law",
        "shield"
      ],
      "cameraIntent": "pan_left",
      "motion": "pan",
      "backgroundMode": "gradient",
      "overlays": [
        "grain",
        "vignette"
      ],
      "palette": {
        "background": "#1e1b4b",
        "secondary": "#312e81"
      },
      "mood": "neutral",
      "timingHints": {
        "baseSeconds": 10
      },
      "profileOverrides": {}
    },
    {
      "sceneId": "scene_06",
      "label": "Cause layer 3",
      "purpose": "feedback_loop",
      "narrationText": "Over time, feedback loops reinforce the pattern and make the system harder to change.",
      "onScreenText": "Feedback Loops",
      "subtext": "Complex interactions emerging at the deepest layer.",
      "visualGrammar": "feedback_loop",
      "visual": "lattice",
      "visualDirection": "Reveal the deeper feedback structure with denser motion and higher visual complexity.",
      "assetRefs": [
        "network",
        "gear",
        "algorithm",
        "law",
        "shield"
      ],
      "cameraIntent": "dramatic_pull_back",
      "motion": "drift",
      "backgroundMode": "mesh",
      "overlays": [
        "grain",
        "vignette",
        "scanlines"
      ],
      "palette": {
        "background": "#1e1b4b",
        "secondary": "#312e81"
      },
      "mood": "stressed",
      "timingHints": {
        "baseSeconds": 10
      },
      "profileOverrides": {}
    },
    {
      "sceneId": "scene_07",
      "label": "Data lens",
      "purpose": "data_lens",
      "narrationText": "The data lens helps separate intuition from measurement and shows which pressures are actually growing.",
      "onScreenText": "Data Lens",
      "subtext": "The numbers tell a distinctly different story.",
      "visualGrammar": "data_lens",
      "visual": "neural_core",
      "visualDirection": "Shift to a data-centric visual that feels analytical and system-wide.",
      "assetRefs": [
        "ai",
        "network",
        "cloud",
        "law",
        "shield"
      ],
      "cameraIntent": "slow_pan_up",
      "motion": "drift",
      "backgroundMode": "mesh",
      "overlays": [
        "grain",
        "vignette",
        "scanlines"
      ],
      "palette": {
        "background": "#1e1b4b",
        "secondary": "#312e81"
      },
      "mood": "thinking",
      "timingHints": {
        "baseSeconds": 10
      },
      "profileOverrides": {}
    },
    {
      "sceneId": "scene_08",
      "label": "Real world scene",
      "purpose": "real_world_example",
      "narrationText": "What looks abstract in theory appears in the real world as daily constraints, tradeoffs, and visible pressure points.",
      "onScreenText": "Real World",
      "subtext": "How policy translates into physical execution.",
      "visualGrammar": "real_world_example",
      "visual": "city",
      "visualDirection": "Bring the abstract explanation back to a concrete everyday environment.",
      "assetRefs": [
        "home",
        "transport",
        "factory"
      ],
      "cameraIntent": "pan_right",
      "motion": "pan",
      "backgroundMode": "gradient",
      "overlays": [
        "grain",
        "vignette"
      ],
      "palette": {
        "background": "#1e1b4b",
        "secondary": "#312e81"
      },
      "mood": "neutral",
      "timingHints": {
        "baseSeconds": 10
      },
      "profileOverrides": {}
    },
    {
      "sceneId": "scene_09",
      "label": "Ecology/externalities",
      "purpose": "externality",
      "narrationText": "Every system pushes some costs outward, and those hidden externalities are often what people notice last.",
      "onScreenText": "Hidden Costs",
      "subtext": "Tracing the unintended environmental consequences.",
      "visualGrammar": "externality",
      "visual": "animals",
      "visualDirection": "Show hidden side effects with ecological or externality imagery.",
      "assetRefs": [
        "bird",
        "fish",
        "bee"
      ],
      "cameraIntent": "slow_zoom_in",
      "motion": "pan",
      "backgroundMode": "gradient",
      "overlays": [
        "grain",
        "vignette"
      ],
      "palette": {
        "background": "#1e1b4b",
        "secondary": "#312e81"
      },
      "mood": "neutral",
      "timingHints": {